{
  "metadata": {
    "contract_version": "1.0",
    "engine_version": "1.0",
    "plugin": "google_ads",
    "generated_at": "2026-07-22T02:07:32.931Z"
  },
  "executive_summary": "Executive Summary: Over the last 30 days (Jun 22 – Jul 21, 2026), the account spent $2,488.08, driving 1,147 clicks, 130,036 impressions, and 213.94 conversions. This represents a highly efficient operation with strong customer acquisition costs across both your Search and Performance Max campaigns.",
  "biggest_wins": [
    "Active campaigns driving baseline conversions."
  ],
  "biggest_risks": [
    "No immediate high-priority risks detected."
  ],
  "immediate_actions": [
    "Continue monitoring campaign performance."
  ],
  "long_term_strategy": "Focus on reallocating wasted spend from poor performing segments into top converting campaigns to scale ROI.",
  "overall_business_assessment": "Stable but needs optimization."
}